{
  "schema_version": "1.0",
  "generated": "2026-06-22",
  "target": "src/caliper (entire codebase)",
  "focus": [
    "correctness",
    "design"
  ],
  "models": {
    "reviewer": "haiku",
    "challenger": "haiku",
    "verifier": null
  },
  "stats": {
    "raw": 117,
    "confirmed": 69,
    "false_positive": 38,
    "uncertain": 10,
    "by_severity": {
      "high": 20,
      "medium": 32,
      "low": 17
    }
  },
  "findings": [
    {
      "id": "P02-1",
      "file": "src/caliper/core/normalizer.py",
      "line": "40",
      "severity": "high",
      "category": "correctness",
      "claim": "Dedup key includes advisory_id which may be None, causing unrelated findings to silently collide and disappear.",
      "evidence": "Line 38-45: The dedup logic uses `key = (f.advisory_id, f.category, f.package_name, f.version)`. \nWhen advisory_id is None (valid for findings from detectors, e.g., CAL-019), two distinct \ncode smell findings collapse under the same key. The higher-severity one wins (line 42-45), \nbut the dedup is silent and incorrect \u2014 they should not deduplicate at all.\n\nPer models.py line 137: `advisory_id: str | None = None` \u2014 advisory_id is nullable.\nPer CAL-019 detector: This exact pattern is flagged as a reliability issue in production code.",
      "fix": "Use `advisory_id or \"\"` to ensure None advisory_ids produce distinct keys. \nChange line 40 to: `key = (f.advisory_id or \"\", f.category, f.package_name, f.version)`",
      "verdict": "CONFIRMED",
      "verdict_reason": "Line 40 of normalizer.py uses `key = (f.advisory_id, f.category, f.package_name, f.version)` for deduplication. When advisory_id is None (valid for code-smell findings from detectors like CAL-019 per line 137 of models.py), two distinct findings collapse under the same key because None is hashable. The higher-severity one wins (line 42-45), but the dedup is incorrect \u2014 unrelated findings should not merge. Using `f.advisory_id or \"\"` ensures None values produce distinct keys.",
      "partition": "P02"
    },
    {
      "id": "P03-1",
      "file": "src/caliper/core/opa_adapter.py",
      "line": "65-74",
      "severity": "high",
      "category": "correctness",
      "claim": "OPA command argument order differs from policy.py, placing --format before data.policy instead of after, breaking CLI parsing.",
      "evidence": "opa_adapter.py cmd=[\"opa\",\"eval\",\"-d\",policy_path,\"-i\",tmp.name,\"--format\",\"json\",\"data.policy\"] vs policy.py cmd=[..., \"data.policy\",\"--format\",\"json\"]. OPA CLI expects data.policy to come after all flags.",
      "fix": "Reorder opa_adapter.py cmd to match policy.py: [\"opa\", \"eval\", \"-d\", policy_path, \"-i\", tmp.name, \"data.policy\", \"--format\", \"json\"]",
      "verdict": "CONFIRMED",
      "verdict_reason": "opa_adapter.py cmd (lines 65-74) places \"--format\" before \"data.policy\", while policy.py cmd (lines 184-193) places \"data.policy\" before \"--format\". OPA CLI expects positional arguments after flags, making policy.py's order correct.",
      "partition": "P03"
    },
    {
      "id": "P03-2",
      "file": "src/caliper/core/opa_adapter.py",
      "line": "107-109",
      "severity": "high",
      "category": "correctness",
      "claim": "Config merge uses shallow update(), losing rules_enabled defaults when caller passes a rules_enabled dict override.",
      "evidence": "opa_adapter.py _build_opa_input uses dict.update(input.config) which replaces entire rules_enabled key. policy.py lines 82-85 correctly deep-merge rules_enabled by checking isinstance and merging. If caller passes {\"rules_enabled\":{\"critical_vuln\":False}} to disable one rule, opa_adapter will lose all other default rules instead of disabling just that one.",
      "fix": "Replace line 109 with proper deep merge like policy.py: if \"rules_enabled\" in input.config and isinstance(input.config[\"rules_enabled\"], dict), merge rules instead of replace.",
      "verdict": "CONFIRMED",
      "verdict_reason": "Line 109 uses dict.update(input.config) which replaces the entire \"rules_enabled\" key. If a package config overrides a single rule with {\"rules_enabled\":{\"critical_vuln\":False}}, all other default rules are lost instead of merging. Policy.py lines 81-85 correctly implements deep-merge by checking isinstance.",
      "partition": "P03"
    },
    {
      "id": "P01-5",
      "file": "src/caliper/core/pipeline.py",
      "line": "240-254",
      "severity": "high",
      "category": "correctness",
      "claim": "Exception handler builds ReviewDecision with scan_results variable from outer loop scope, which may be stale if orchestrator.run has not completed or has failed.",
      "evidence": "At lines 186-254, the try-except catches exceptions during per-package evaluation. If an exception occurs, lines 241-254 create a fallback ReviewDecision using scan_results (from line 169). However, scan_results is the result of orchestrator.run(repo_path) executed once before the loop. If the orchestrator itself fails (e.g., all scanners timeout or crash), scan_results may be a list of ScanResult.skipped or ScanResult.failed objects, and the fallback decision will reuse this potentially invalid scan data. The decision should use an empty list or a clearly marked \"scan data unavailable\" indicator instead of reusing outer-loop state.",
      "fix": "Initialize an empty scan_results_fallback list before the per-package try-except and use it in the exception handler: scan_results_fallback = [] or a dedicated placeholder. Pass this to the fallback ReviewDecision so the decision reflects that scan data was unavailable during the error.",
      "verdict": "CONFIRMED",
      "verdict_reason": "The finding correctly identifies that the exception handler at lines 239-254 reuses scan_results from line 169, which is the result of orchestrator.run(repo_path) executed before the per-package loop. If an exception occurs during package evaluation (lines 186-238), the fallback ReviewDecision (lines 241-254) uses this scan_results value. However, if orchestrator.run() itself failed or returned skipped/timeout results, those stale results are reused in the fallback decision, which may be misleading about the cause of the error.",
      "partition": "P01"
    },
    {
      "id": "P05-5",
      "file": "src/caliper/core/repo_config.py",
      "line": "69",
      "severity": "high",
      "category": "correctness",
      "claim": "Falsy-value merge bug in load_merged_config causes empty list overrides to fall back to root config",
      "evidence": "Line 69-70: disabled=pkg_config.plugins.disabled or root_config.plugins.disabled\nThis uses Python's or operator, which treats empty list [] as falsy. If a package config\nexplicitly sets disabled: [] (meaning \"disable nothing at package level\"), the merge\nincorrectly falls back to root_config.plugins.disabled because [] evaluates to False.\nExample: root has disabled: [\"trivy\"], package has disabled: [] (override),\nbut merged result gets [\"trivy\"] instead of [].\nSame bug applies to enabled field on line 69.",
      "fix": "Use explicit None checks instead of or: \"disabled = pkg_config.plugins.disabled if pkg_config.plugins.disabled is not None else root_config.plugins.disabled\"",
      "verdict": "CONFIRMED",
      "verdict_reason": "Lines 69-70 use \"or\" operator which treats empty list [] as falsy. If package config explicitly sets disabled: [] to override root disabled: [\"trivy\"], the merge incorrectly falls back to root value because [] evaluates to False. Same bug on enabled field. Requires explicit None checks.",
      "partition": "P05"
    },
    {
      "id": "P05-6",
      "file": "src/caliper/core/repo_config.py",
      "line": "68",
      "severity": "high",
      "category": "correctness",
      "claim": "SemgrepConfig from package-level .caliper.yaml is completely ignored during merge",
      "evidence": "In load_merged_config(), the merged PluginConfig is constructed on line 68-71 \nwith only enabled and disabled fields. The semgrep field defaults to \nSemgrepConfig() (empty lists), completely discarding pkg_config.plugins.semgrep.\nIf a package provides extra_config_dirs or exclude_rules in its .caliper.yaml,\nthey are silently lost during the merge. The docstring (lines 54-59) does not mention\nthat semgrep config is NOT merged, suggesting this is unintentional.",
      "fix": "Merge semgrep config: create merged_semgrep = SemgrepConfig(...) that combines root and package values, then pass it to PluginConfig",
      "verdict": "CONFIRMED",
      "verdict_reason": "Lines 68-71 construct merged_plugins with only enabled/disabled fields. SemgrepConfig defaults to empty SemgrepConfig() on line 31, completely discarding pkg_config.plugins.semgrep. Package-level extra_config_dirs or exclude_rules are silently lost during merge, contradicting the docstring intent.",
      "partition": "P05"
    },
    {
      "id": "P04-1",
      "file": "src/caliper/core/seal.py",
      "line": "202",
      "severity": "high",
      "category": "correctness",
      "claim": "Timestamp sorting for seal chain is vulnerable to lexicographic ordering bugs, not RFC3339 temporal ordering.",
      "evidence": "Line 202: `seals.sort(key=lambda x: x[0], reverse=True)`\n\nThe timestamp string x[0] is sorted lexicographically, not by temporal value.\nTimestamps in ISO8601/RFC3339 format (e.g., \"2026-04-23T14:30:00Z\") happen to sort\ncorrectly lexicographically only within a single day and timezone. Across days/zones:\n- \"2026-04-23T23:59:00+00:00\" sorts AFTER \"2026-04-24T00:01:00+00:00\" (wrong)\n- \"2026-04-23T14:30:00+05:00\" vs \"2026-04-23T14:30:00-05:00\" produce incorrect order\n\nTest line 202 uses only same-day timestamps, masking the bug. Real runs crossing\nday/zone boundaries will select wrong previous_seal_hash, breaking the integrity chain.",